{
  "$schema": "https://github.com/AndrewAltimit/swarmchasing/blob/main/schemas/sc-bench-v1.json",
  "description": "The committed evaluation set (samples/eval/*.ndjson): synthetic fixtures and reconstructions of published incidents with hand-written benign look-alikes. The reference rules were tuned on it, so every record is in the regression split.",
  "format": "sc-bench-v1",
  "freeze_date": "2026-10-10",
  "name": "sc-bench-example",
  "records": [
    {
      "actor": "tool",
      "cluster": "k-2bd95846",
      "fired_rules": [
        "exploit.sqli_quote"
      ],
      "host": "intranet[.]lab[.]example",
      "id": "eval:act-active-scan-1",
      "labellers": [
        "swarmchasing-maintainers"
      ],
      "provenance": "synthetic",
      "source": "eval",
      "split": "regression",
      "tier": "suggestive",
      "ts": "2026-05-16T09:30:00Z",
      "ts_kind": "unknown"
    },
    {
      "actor": "tool",
      "fired_rules": [],
      "host": "intranet[.]lab[.]example",
      "id": "eval:act-active-scan-2",
      "labellers": [
        "swarmchasing-maintainers"
      ],
      "provenance": "synthetic",
      "source": "eval",
      "split": "regression",
      "tier": "noise",
      "ts": "2026-05-16T09:30:00Z",
      "ts_kind": "unknown"
    },
    {
      "actor": "tool",
      "cluster": "k-2bd95846",
      "fired_rules": [
        "exploit.sqli_boolean"
      ],
      "host": "intranet[.]lab[.]example",
      "id": "eval:act-active-scan-3",
      "labellers": [
        "swarmchasing-maintainers"
      ],
      "provenance": "synthetic",
      "source": "eval",
      "split": "regression",
      "tier": "significant",
      "ts": "2026-05-16T09:30:01Z",
      "ts_kind": "unknown"
    },
    {
      "actor": "tool",
      "cluster": "k-2bd95846",
      "fired_rules": [
        "exploit.sqli_boolean"
      ],
      "host": "intranet[.]lab[.]example",
      "id": "eval:act-active-scan-4",
      "labellers": [
        "swarmchasing-maintainers"
      ],
      "provenance": "synthetic",
      "source": "eval",
      "split": "regression",
      "tier": "significant",
      "ts": "2026-05-16T09:30:02Z",
      "ts_kind": "unknown"
    },
    {
      "actor": "tool",
      "cluster": "k-2bd95846",
      "fired_rules": [
        "carrier.html_program",
        "exploit.xss"
      ],
      "host": "intranet[.]lab[.]example",
      "id": "eval:act-active-scan-5",
      "labellers": [
        "swarmchasing-maintainers"
      ],
      "provenance": "synthetic",
      "source": "eval",
      "split": "regression",
      "tier": "significant",
      "ts": "2026-05-16T09:30:03Z",
      "ts_kind": "unknown"
    },
    {
      "actor": "tool",
      "cluster": "k-2bd95846",
      "fired_rules": [
        "exploit.ssti"
      ],
      "host": "intranet[.]lab[.]example",
      "id": "eval:act-active-scan-6",
      "labellers": [
        "swarmchasing-maintainers"
      ],
      "provenance": "synthetic",
      "source": "eval",
      "split": "regression",
      "tier": "significant",
      "ts": "2026-05-16T09:30:04Z",
      "ts_kind": "unknown"
    },
    {
      "actor": "tool",
      "fired_rules": [],
      "host": "intranet[.]lab[.]example",
      "id": "eval:act-active-scan-7",
      "labellers": [
        "swarmchasing-maintainers"
      ],
      "provenance": "synthetic",
      "source": "eval",
      "split": "regression",
      "tier": "noise",
      "ts": "2026-05-16T09:30:05Z",
      "ts_kind": "unknown"
    },
    {
      "actor": "human",
      "cluster": "k-b8b91ba5",
      "fired_rules": [
        "exploit.sqli_boolean",
        "marker.placeholder"
      ],
      "host": "login[.]coop[.]example",
      "id": "eval:act-chatbot-help-1",
      "labellers": [
        "swarmchasing-maintainers"
      ],
      "provenance": "synthetic",
      "source": "eval",
      "split": "regression",
      "tier": "significant",
      "ts": "2026-05-13T16:40:00Z",
      "ts_kind": "unknown"
    },
    {
      "actor": "human",
      "cluster": "k-b8b91ba5",
      "fired_rules": [
        "exploit.sqli_boolean",
        "marker.placeholder"
      ],
      "host": "login[.]coop[.]example",
      "id": "eval:act-chatbot-help-2",
      "labellers": [
        "swarmchasing-maintainers"
      ],
      "provenance": "synthetic",
      "source": "eval",
      "split": "regression",
      "tier": "significant",
      "ts": "2026-05-13T16:41:05Z",
      "ts_kind": "unknown"
    },
    {
      "actor": "human",
      "cluster": "k-b8b91ba5",
      "fired_rules": [
        "exploit.sqli_boolean",
        "marker.placeholder"
      ],
      "host": "login[.]coop[.]example",
      "id": "eval:act-chatbot-help-3",
      "labellers": [
        "swarmchasing-maintainers"
      ],
      "provenance": "synthetic",
      "source": "eval",
      "split": "regression",
      "tier": "significant",
      "ts": "2026-05-13T16:42:45Z",
      "ts_kind": "unknown"
    },
    {
      "actor": "human",
      "cluster": "k-b8b91ba5",
      "fired_rules": [
        "exploit.sqli_boolean",
        "marker.placeholder"
      ],
      "host": "login[.]coop[.]example",
      "id": "eval:act-chatbot-help-4",
      "labellers": [
        "swarmchasing-maintainers"
      ],
      "provenance": "synthetic",
      "source": "eval",
      "split": "regression",
      "tier": "significant",
      "ts": "2026-05-13T16:44:00Z",
      "ts_kind": "unknown"
    },
    {
      "actor": "human",
      "cluster": "k-34333b1b",
      "fired_rules": [
        "exploit.sqli_quote"
      ],
      "host": "portal[.]clinic[.]example",
      "id": "eval:act-repeater-1",
      "labellers": [
        "swarmchasing-maintainers"
      ],
      "provenance": "synthetic",
      "source": "eval",
      "split": "regression",
      "tier": "suggestive",
      "ts": "2026-05-11T14:02:10Z",
      "ts_kind": "unknown"
    },
    {
      "actor": "human",
      "cluster": "k-34333b1b",
      "fired_rules": [
        "exploit.sqli_boolean"
      ],
      "host": "portal[.]clinic[.]example",
      "id": "eval:act-repeater-2",
      "labellers": [
        "swarmchasing-maintainers"
      ],
      "provenance": "synthetic",
      "source": "eval",
      "split": "regression",
      "tier": "significant",
      "ts": "2026-05-11T14:03:05Z",
      "ts_kind": "unknown"
    },
    {
      "actor": "human",
      "cluster": "k-34333b1b",
      "fired_rules": [
        "exploit.sqli_boolean"
      ],
      "host": "portal[.]clinic[.]example",
      "id": "eval:act-repeater-3",
      "labellers": [
        "swarmchasing-maintainers"
      ],
      "provenance": "synthetic",
      "source": "eval",
      "split": "regression",
      "tier": "significant",
      "ts": "2026-05-11T14:04:15Z",
      "ts_kind": "unknown"
    },
    {
      "actor": "human",
      "cluster": "k-34333b1b",
      "fired_rules": [
        "exploit.sqli_union"
      ],
      "host": "portal[.]clinic[.]example",
      "id": "eval:act-repeater-4",
      "labellers": [
        "swarmchasing-maintainers"
      ],
      "provenance": "synthetic",
      "source": "eval",
      "split": "regression",
      "tier": "significant",
      "ts": "2026-05-11T14:05:03Z",
      "ts_kind": "unknown"
    },
    {
      "actor": "human",
      "cluster": "k-34333b1b",
      "fired_rules": [
        "exploit.sqli_union"
      ],
      "host": "portal[.]clinic[.]example",
      "id": "eval:act-repeater-5",
      "labellers": [
        "swarmchasing-maintainers"
      ],
      "provenance": "synthetic",
      "source": "eval",
      "split": "regression",
      "tier": "significant",
      "ts": "2026-05-11T14:06:05Z",
      "ts_kind": "unknown"
    },
    {
      "actor": "human",
      "cluster": "k-34333b1b",
      "fired_rules": [
        "exploit.sqli_union"
      ],
      "host": "portal[.]clinic[.]example",
      "id": "eval:act-repeater-6",
      "labellers": [
        "swarmchasing-maintainers"
      ],
      "provenance": "synthetic",
      "source": "eval",
      "split": "regression",
      "tier": "significant",
      "ts": "2026-05-11T14:07:35Z",
      "ts_kind": "unknown"
    },
    {
      "actor": "tool",
      "cluster": "k-4da1c4fa",
      "fired_rules": [
        "exploit.sqli_boolean"
      ],
      "host": "api[.]parts[.]example",
      "id": "eval:act-sqlmap-1",
      "labellers": [
        "swarmchasing-maintainers"
      ],
      "provenance": "synthetic",
      "source": "eval",
      "split": "regression",
      "tier": "significant",
      "ts": "2026-05-14T03:20:00Z",
      "ts_kind": "unknown"
    },
    {
      "actor": "tool",
      "cluster": "k-4da1c4fa",
      "fired_rules": [
        "exploit.sqli_boolean"
      ],
      "host": "api[.]parts[.]example",
      "id": "eval:act-sqlmap-2",
      "labellers": [
        "swarmchasing-maintainers"
      ],
      "provenance": "synthetic",
      "source": "eval",
      "split": "regression",
      "tier": "significant",
      "ts": "2026-05-14T03:20:01Z",
      "ts_kind": "unknown"
    },
    {
      "actor": "tool",
      "cluster": "k-4da1c4fa",
      "fired_rules": [
        "exploit.sqli_boolean"
      ],
      "host": "api[.]parts[.]example",
      "id": "eval:act-sqlmap-3",
      "labellers": [
        "swarmchasing-maintainers"
      ],
      "provenance": "synthetic",
      "source": "eval",
      "split": "regression",
      "tier": "significant",
      "ts": "2026-05-14T03:20:01Z",
      "ts_kind": "unknown"
    },
    {
      "actor": "tool",
      "cluster": "k-4da1c4fa",
      "fired_rules": [
        "exploit.sqli_boolean"
      ],
      "host": "api[.]parts[.]example",
      "id": "eval:act-sqlmap-4",
      "labellers": [
        "swarmchasing-maintainers"
      ],
      "provenance": "synthetic",
      "source": "eval",
      "split": "regression",
      "tier": "significant",
      "ts": "2026-05-14T03:20:02Z",
      "ts_kind": "unknown"
    },
    {
      "actor": "tool",
      "cluster": "k-4da1c4fa",
      "fired_rules": [